{
  "workflow": "sdd",
  "currentStep": "implement",
  "currentTask": null,
  "progress": "commit-review",
  "next": "done",
  "updated": "2026-04-13",
  "selectedAt": "2026-04-13T00:00:00.000Z",
  "specName": "Fix Auto Mode Stall",
  "branch": "main",
  "createdAt": "2026-04-13T00:00:00.000Z",
  "approach": "Move auto flag before specify invocation, add explicit loop continuation instructions",
  "files_modified": ["skills/auto/SKILL.md"],
  "last_action": "T002 complete — added CRITICAL loop continuation instructions to auto-advance loop",
  "decisions": [],
  "concerns": [],
  "task_summaries": {
    "T001": {
      "status": "DONE",
      "did": "Merged Set Auto Flag into Step 1 (after specify returns), removed old Step 2, renumbered steps",
      "files": ["skills/auto/SKILL.md"],
      "concerns": []
    },
    "T002": {
      "status": "DONE",
      "did": "Added CRITICAL anti-stall instructions at loop header, after Skill invocation, and at loop-back point",
      "files": ["skills/auto/SKILL.md"],
      "concerns": []
    }
  },
  "step_summaries": {
    "specify": {
      "complexity": "minimal",
      "requirements": 3,
      "scenarios": 2,
      "key_finding": "Auto flag is set in Step 2 after specify returns, but specify reads auto in Step 7 — the flag is never true when specify checks it during an auto run"
    }
  }
}
